<?xml version="1.0" encoding="UTF-8"?>
<!DOCTYPE supermercado SYSTEM "ejer1.dtd">
<supermercado>
<articulo n_art="articulo1" cantidad="300">
<descripcion>Yogurt</descripcion>
<marca tipo="nacional">Danone</marca>
<medida unidad="Sistema Internacional">200 ml</medida>
<seccion>Lacteos</seccion>
</articulo>
<articulo n_art="articulo2">
<descripcion>Queso fresco</descripcion>
<marca tipo="nacional">Burgo de Arias</marca>
<medida>250 gr</medida>
<seccion>Lacteos</seccion>
<oferta>Lote descuento</oferta>
<perecedero>
<caducidad>febrero de 2022</caducidad>
</perecedero>
</articulo>
</supermercado>